correct,student_id,Text,Uncertainty,Feature Vectors,Other Strategy,Time
TRUE,Student 34,"We know nothing about the velocity of the box, so we cannot make any statements about the velocity's direction. However, we know through Newton's second law that the direction of the net force on an object is the same direction as the object's acceleration. The net force on the box is in the positive x direction, so we know that the acceleration of the box is parallel to the x-axis.",2,"(1,1,0,1,0,0,0,0,0)",1,40:43
TRUE,Student 47,"According to Newton's 2nd law, force and acceleration is proportional and have the same direction. Although, velocity does not. Change in velocity has the same direction of force and acceleration, but this is asking about the velocity when the box is in motion, which is not necessarily directly related to the direction of force and acceleration.",2,"(1,1,0,0,0,0,1,0,0)",1,21:48
TRUE,Student 28,"The net force (which is the force that determines an object's direction of acceleration) is moving in the positive x direction, meaning that the acceleration will also be in the positive x direction. However, the velocity does not necessarily have to be in the x direction. Depending on the time that you are measuring an object's velocity, it can move in any direction, although it will eventually go in the direction of the x-axis if. this force is continually exerted.",2,"(1,1,0,1,1,1,1,1,1)",0,22:23
TRUE,Student 29,"The box is accelerating in the x direction because force and acceleration are always in the same direction. However, the force could be in a different direction from the velocity if the box had already been moving in the negative x direction.",2,"(1,1,0,1,0,1,0,0,0)",0,17:23
TRUE,Student 76,"Force and acceleration are directly related, so the acceleration would be parallel to the x axis.",2,"(0,0,0,0,0,0,0,0,0)",1,24:45
TRUE,Student 23,"According to Newton's second law, the acceleration is provided by the net force acting on an object, which means the acceleration will have the same direction as the net force. Therefore, the acceleration is parallel to the x-axis. However, the velocity of the box could have any directions, because it could be a property that the box originally has, and it does not have to be parallel to the net force acting on the box.",2,"(1,1,0,1,1,0,0,1,1)",1,28:39
TRUE,Student 27,"Newton's second law states that F=ma so the force parallel to the x axis will equal the acceleration parallel to the x axis. Acceleration is the change in velocity. So even if the acceleration is parallel to the x axis, it does not guarantee that the change in velocity will be parallel to the x axis. Change in velocity does not equal velocity.",2,"(0,0,0,0,0,0,0,0,0)",1,24:02
TRUE,Student 4,"We do not know the box's initial velocity, so we can't know if its velocity is parallel to the x axis, but the force vector is proportional to the acceleration vector, so the acceleration will be parallel to the x axis if the force is in the positive x direction.",2,"(1,1,0,1,0,1,0,0,0)",1,25:52
TRUE,Student 78,"Since the net force on the box is in the positive x-direction, the box's acceleration would remain parallel to the x-axis. However, since the velocity is increasing due to the acceleration being constant, it will look like a linear graph, therefore not being parallel to the x-axis.",2,"(1,1,0,0,0,0,1,1,1)",1,44:54
FALSE,Student 62,"Neither the velocity nor the acceleration need to be parallel to the x axis because the net force could still be moving in the positive x direction but at an angle. As a result, if the force is moving at an angle, then its acceleration is as well, and the velocity could be.",4,"(0,0,0,0,0,0,0,0,0)",0,21:02
TRUE,Student 87,"The net force determines the direction of acceleration, therefore the acceleration of the box must be in the positive x-direction. However, the object's velocity (both direction and magnitude are not known, because the object could have started at a velocity, in any direction. Acceleration only indicates the direction of the change in velocity. For example, if the box was already moving at a constant velocity in the negative y-direction, its positive x acceleration would turn to shift the box's velocity to have an increasing (with time) velocity in the x-direction in addition to the negative y velocity it started with. Therefore the combined velocity at any given point would have both a negative y component and a positive x component, but it wouldn't ever be parallel to the x-axis (in this example).",2,"(1,1,0,1,1,1,1,1,1)",0,46:03
FALSE,Student 38,"I'm reading this as net force implying that there are multiple forces acting on this box. Clearly the force pushing in the positive x direction is larger than any of the other forces acting in different directions, which makes the net force point in the positive x direction. Still, these other forces need to be taken into account, so even though it would be moving in a generally positive direction, perhaps the acceleration is pointing slightly upwards rather than being perfectly parallel to the x axis because of a small force acting upwards on the box. That's why I chose the last option-- even though the acceleration is positive, it doesn't mean that it HAS to be parallel to the x axis.",4,"(1,1,0,0,1,0,1,1,1)",0,42:25
TRUE,Student 51,"According to Newton's second law, the direction of the net force is the same as the direction of the object's acceleration. This means that the box has to have an acceleration that is parallel to the x axis. However, this does not necessarily mean that its velocity is also parallel to the x axis, as an object can have a velocity that is in a different direction than its acceleration.",2,"(1,1,0,0,1,0,0,0,0)",1,11:47
TRUE,Student 88,"The acceleration of the box is parallel to the x axis because force is reliant on mass and acceleration, and in order for the box to accelerate there must be forces acting upon it. Therefore, if the net force is in the positive x direction the acceleration will be parallel to the x axis.",2,"(1,1,1,0,0,0,0,1,1)",0,43:16
TRUE,Student 8,"The acceleration vector of an object is in the same direction as the force vector applied to that object. This means that acceleration is parallel to the x-axis, in the positive x direction. However, we know nothing about the initial velocity of the box. The box could by traveling in some other axis, a y-direction for instance. Therefore, the velocity is not strictly parallel to the x-axis.",2,"(1,1,0,1,1,1,0,0,0)",0,34:04
TRUE,Student 37,"Just the acceleration is in the same direction of the net force. Because Newton's second law relates Acceleration and Force, the velocity of the box has nothing to do with the direction of the net force.",2,"(1,1,0,0,0,0,1,0,0)",1,12:02
TRUE,Student 66,"Using the information we have been given I think that we can only be sure that the acceleration is parallel to the x axis. I know that acceleration is parallel to the x axis because force and acceleration move in the same direction. I would say that it is likely that the velocity also goes the same direction, but there could be other factors that make this not the case.",2,"(0,0,0,0,0,0,0,0,0)",1,18:27
TRUE,Student 65,"Like it was said in the pre lecture videos, the magnitude of the acceleration of the object id directly proportional to the force or the net force enacted on that object",2,"(1,0,0,0,0,0,0,0,0)",1,32:52
TRUE,Student 58,"The box could have a negative initial velocity. In that case, the net force, according to Newton's second law, would push the box in the positive x direction, giving a positive acceleration, but the acceleration might not catch up to the velocity right away.",2,"(1,1,0,0,0,1,1,1,1)",1,26:31
TRUE,Student 48,"Acceleration is parallel to the x axis because acceleration is directly proportional to the Fnet, so it would make sense that they are parallel (F = ma). Acceleration is dv/dt, which would place velocity in a way I honestly don't know how to deduce. I'm almost trying to think of a car crash coming from the West side. I think the acceleration would be towards the center, but the velocity of the car would go North east opposite to that... but I'm not quite sure.",2,"(1,1,0,0,1,0,1,1,0)",1,28:13
FALSE,Student 77,Since you can set your Cartesian coordinates to where ever you want setting up the movement of the box in the positive x direction will ensure it moves along the x axis and since that is the way it’s velocity is moving the acceleration will also be moving in that direction until it is acted upon by a force that changes that parallel motion. That is not to say though that the motion is parallel. It may move in the positive x direction based on where the origin is but if you have a changing acceleration that will not be parallel nor will the velocity and situations like that cannot be determined without more info,4,"(1,1,0,1,1,1,1,1,1)",0,18:39
TRUE,Student 81,"the net force on an object is equal to the mass times the acceleration vector of that object. If the net force vector is in the positive x direction then so is the acceleration. An object can be accelerating in that direction, but the velocity of the object is not stated in this problem, so the initial velocity might have been in a different direction, causing the velocity in the moment to not be parallel to the x axis.",2,"(1,1,1,1,1,0,0,0,0)",1,24:30
FALSE,Student 82,Force creates acceleration which then creates velocity in the object. Velocity and acceleration vectors result from force meaning they must have the same direction parallel to the x-axis.,3,"(1,1,0,0,1,0,1,1,1)",0,49:24
FALSE,Student 67,I chose c because while forcing of an object equals to the velocity that all moves in the same direction.,3,"(1,1,0,0,1,0,1,1,0)",0,11:34
TRUE,Student 98,"Since we do not know how many forces are acting on the object, we cannot assume that the velocity is parallel to the x-axis. However, the change in velocity, or acceleration, moves in the same direction as the net force because it represents the direction the object is moving. The acceleration vector must be moving in the same direction as the force.",2,"(1,1,0,1,0,0,0,0,0)",0,25:42
FALSE,Student 84,"Based on Newton's second law, accelerations are caused by forces, and the acceleration of an object will have the same direction as the net force applied to that object, thus acceleration is indeed parallel to x axis in the information given. In addition, since acceleration describes the change of velocity with respect to the change in time and momentum is the object's velocity times a factor of object's mass, there is relation between the acceleration vector and the quantity of momentum. The velocity will be parallel to the x axis considering the direction of the net force. However, there isn't enough information given to conclude whether the velocity is in the positive x direction or the negative x direction, as it can be negative but parallel to the x axis as well.",3,"(1,1,1,0,1,0,0,1,1)",1,29:00
TRUE,Student 52,"The force exerted on the box is directly proportional to the acceleration. Since velocity is in regards to acceleration multiplied by the time, the box's velocity between the initial time and the final time will be some constant that demonstrates a linear line or a line with a slope greater than 0, making it not parallel to the x axis",2,"(1,1,0,0,0,1,1,1,0)",1,30:54
TRUE,Student 17,"force causes acceleration and when a force acts on an object, it causes it to accelerate in the same direction that the force is applied.",2,"(1,1,0,0,0,0,0,1,1)",0,45:47
TRUE,Student 44,"While the velocity could be in any direction, this positive x force means we ware pushing it in the x direction, meaning it’s acceleration is parallel to the x axis",2,"(1,1,0,0,1,0,0,1,1)",0,03:07
TRUE,Student 70,"Since net force causes acceleration, the net force and acceleration vectors point in the same direction. This means that the change in velocity is parallel to the x-axis, but without knowing the initial condition of the box, it is impossible to tell which direction the velocity points in. Depending on the acceleration is due to only a change in magnitude of the velocity or if it includes a change in direction, the velocity could or could not point in the same direction as the acceleration.",2,"(1,1,0,0,1,0,1,1,1)",0,31:36
TRUE,Student 43,"Force is responsible for the change in the velocity of the mass, in this case the box, and change in velocity is just acceletation",2,"(1,1,1,0,0,0,0,1,1)",0,22:09
TRUE,Student 40,"Only the acceleration needs to be parallel to the x-direction because Newton's 1st Law states that the acceleration points in the same direction that the force points. However, the velocity doesn't necessarily need to be going in the same direction as the acceleration. Both the velocity and acceleration would be parallel to the x-axis if the box is moving in the same direction as the acceleration and net force. However, it is also possible that the box's velocity is negative, and the net force and acceleration are positive. This scenario would probably be if you were stopping the box from moving towards you.",2,"(1,1,0,1,1,1,1,1,0)",1,32:45
FALSE,Student 61,"The forces that describe the box's motion are only the forces exerted on the box. If the total force on the box is in the x direction, there is no force in the y direction. This means any movement of the box is parallel to the x axis, including velocity and acceleration.",3,"(1,1,0,0,1,0,1,1,0)",0,40:50
FALSE,Student 31,"Since the box has a net force applied to it in the positive x-direction, the box will thus have an acceleration in the positive x-direction (parallel to the x-axis). Since the box has an acceleration in the positive x-direction, the box will thus have an (increasing) velocity in the positive x-direction (parallel to the x-axis).",3,"(1,1,0,0,1,0,1,1,1)",0,22:14
TRUE,Student 24,"I'm not entirely sure if the velocity would be parallel to the x-axis, becuase velocity can also be perpendicular to the x-axis, or in other words parallel to the y-axis. But, since the net force is in the positive x direction, then the acceleration should be in the same direction, since force causes acceleration as discussed in the prelecture videos.",2,"(0,0,0,0,0,0,0,0,1)",0,42:21
TRUE,Student 79,"As we saw in Newton's Second Law, forces cause change in velocity in an object, also known as acceleration. So, forces cause acceleration. The net forces which act upon an object are directly related to the object's acceleration. This means that the force and acceleration vectors are pointed in the same direction. We aren't sure about velocity though, so I didn't want to include that answer as well...",2,"(1,1,0,0,0,0,0,1,1)",1,46:46
TRUE,Student 3,"The acceleration is parallel to the x axis as a force is being applied to the box in the x direction. If understand the concept correctly, force and acceleration work in the same direction. As such, acceleration would be parallel to the x axis. Velocity is not parallel to the x axis because a constant acceleration implies either an increase or decrease in velocity. As such, the velocity vector would appear at an angle to the x axis.",2,"(1,1,0,0,1,0,1,1,0)",0,26:31
TRUE,Student 102,"Unless the box has force exerted on it in the Y direction, the acceleration will only be coming from the x-direction, thus only the acceleration will be in the x direction, parallel to the x axis. If there is a force on the box going in a y direction, the acceleration and velocity would not be parallel, but going in a direction connected by the x and y components. Thus unless there is force exerted in the y direction, the acceleration will be parallel to the x axis. If the net force means the box is only being exerted in a positive x direction, the velocity and acceleration will both be parallel to the x axis.",2,"(1,1,0,0,1,0,1,1,1)",0,01:43
TRUE,Student 95,"There is no stated initial velocity, so the velocity vector's direction is unknown. However, if the net force is in the x direction, the acceleration must be going that direction too.",2,"(0,0,0,0,0,0,0,0,1)",1,02:27
TRUE,Student 60,"We only know about the net force on the box, not its original momentum/motion; there's no way to know that its current velocity is only in the x direction. Therefore, the answer has to be B, due to the net force in the positive x direction and the lack of other information.",2,"(1,1,0,0,1,0,1,0,0)",1,09:04
TRUE,Student 64,"Force is what causes something to accelerate, and, like acceleration, is a vector. The direction of the net-force vector dictates that direction that the box will accelerate.",2,"(1,1,0,0,0,0,0,0,1)",0,25:35
FALSE,Student 12,"If there is a force on the box and force is the thing that causes change in velocity, then velocity and the change in velocity (acceleration) would be in the same direction as the force applied to the box.",3,"(1,1,0,0,1,0,1,1,1)",0,37:22
TRUE,Student 36,Because the box is being pulled in the horizontal direction the acceleration will also be in the horizontal direction which is parallel to the x axis.,2,"(1,1,0,0,1,0,0,1,1)",0,03:20
FALSE,Student 72,"Newton's second law demonstrates that acceleration is in the same direction as force. For this to be true, velocity does not necessarily need to be in the same direction. Although the total net force is in the positive direction, there are more than one forces in consideration and these forces are not necessarily in the positive x direction. There could another force in the negative direction which means it has its own acceleration vector going in the negative direction. Just because the sum of the forces are a positive value, does not mean that there are no negative forces with negative accelerations at play.",4,"(0,0,0,0,0,0,0,0,0)",1,36:55
FALSE,Student 85,"The acceleration of an object is caused by the force on that object. So, if the net force is in the positive x direction, that means the acceleration will be too. Further, acceleration is a change in velocity over time, so velocity must also be in the same direction. I’m a little confused, though, because I think that the box could be moving at a constant velocity in the negative x direction and still have an acceleration in the positive x direction due to a net force in that direction, which would just mean that its motion would be in the negative x direction but it would be slowing down. However, I think this would still mean that both velocity and acceleration are PARALLEL to the x axis. I also think the question is kind of confusing, because couldn't the force on the box be in the positive x direction while and the positive y direction, moving at an angle to the x axis, not parallel? I feel like C is maybe the best answer, but I can't really pin down why. It's kind of a gut feeling, but it also seems too easy.",3,"(1,1,0,1,1,1,1,1,1)",0,23:39
TRUE,Student 22,"Using Newton's Second Law, we can state that a = F/m. Since force is being used consistently in the positive x direction and the mass does not change, the acceleration is constant and thus parallel to the x-axis. The velocity thus has a positive slope, given acceleration is the derivative of velocity",2,"(0,0,0,0,0,0,0,0,0)",1,21:26
FALSE,Student 103,"By Newton's 2-law net force has same direction as acceleration, because external force makes object to accelerate. So acceleration is in the positive x direction. If box was in rest before being pushed by force, it means that velocity is also created by same acceleration. If we just imagine net force and acceleration in positive x direction, velocity will be in same direction.",3,"(1,1,0,0,1,0,1,1,1)",1,29:08
FALSE,Student 7,"I'm not completely sure if I am right, but I think it would make sense if both the velocity and the acceleration are in the x-direction because that is the direction in which the force is being exerted.",3,"(0,0,0,0,0,0,0,0,0)",0,18:58
TRUE,Student 54,"Since the acceleration is determined by the force/mass and mass is only a scalar quantity and not a vector, then the acceleration vector will have the same direction as the force. We know that the force vector is parallel to the x-axis so the acceleration is as well. if the box started at rest then the velocity have the same direction as the acceleration, but we were not given that initial condition, so there is no way to know if the change in velocity is equal in direction to the initial velocity.",2,"(1,1,1,0,1,1,1,0,0)",1,19:32
TRUE,Student 69,"Since Force and Acceleration depend on each other, the force exerted on the box should be roughly proportional. Also since the problem said the net force is in the positive direction then we can deduce that the acceleration is also in the positive x-direction since a = F/m",2,"(1,1,0,0,0,0,0,1,0)",1,27:18
TRUE,Student 86,"Acceleration will act in the same way that the force on the box does. Since, the box is moving in the positive x direction, acceleration will do the same so acceleration is parallel to the x axis",2,"(1,1,0,0,1,0,1,1,0)",1,44:23
TRUE,Student 6,The acceleration is parallel to the x axis because F=ma so the direction of the force is the same as the acceleration and therefore the acceleration is parallel to the x axis.,2,"(0,0,0,0,0,0,0,0,0)",1,02:19
FALSE,Student 26,"Since the net force on a box is in the positive x direction, its acceleration must also be in the positive x direction because force causes acceleration so the direction of force equals the direction of acceleration. Intuitively, if the net force on a box is in the positive x direction, the box must be moving in the positive x direction, which would mean the velocity vector should be parallel to the x axis.",3,"(1,1,0,0,1,0,1,1,1)",0,22:58
TRUE,Student 35,"According to newton's first law, the acceleration is directly proportional and in the same direction as the motion.",2,"(0,0,0,0,0,0,0,0,0)",1,22:37
TRUE,Student 50,"Force and acceleration are directly related. Net force is the mass times the acceleration. If net force results in a positive x direction, the acceleration is also in that direction.",2,"(0,0,0,0,0,0,0,0,0)",1,25:29
FALSE,Student 1,"When a force is exerted on an object, it accelerates in the direction of the force. Since the object is accelerating, it also has velocity in that same direction.",3,"(1,1,0,0,1,0,1,1,1)",0,23:37
TRUE,Student 10,"I think you can invoke newton's second law that related mass, force, and acceleration. The magnitude of acceleration is proportional to the force. The force causes an object to accelerate in the direction of the force. If you apply a force to an object, it will cause a change in motion (start/stop/slow down/speed up) and it makes sense the direction of the force would be the same as the acceleration. Pushing a box to the left (applying a leftward force) should cause it to move to the left.",2,"(1,1,0,0,0,0,1,1,1)",1,39:12
TRUE,Student 74,"Newton's 2nd law says that an object accelerates in same direction as force. This means that the acceleration is parallel to the x axis, since the net force is in the positive x direction (only, meaning no movement in y directions). However, just because an object is accelerating in a specific direction does not mean that the velocity is always in that same direction; it just means that the velocity is changing in that direction. No Newton law says what the velocity will be, so this is the only answer.",2,"(1,1,0,0,1,0,1,0,0)",1,36:20
TRUE,Student 71,"Newton's second law states that Force = Mass x Acceleration. This applies to the direction as well as the magnitude. What we can conclude then, is that the direction of the net force will always be in the same direction of the acceleration. I want to describe my explanation further with a diagram but I cannot. Something I learned in the last class was velocity and acceleration can be in two different directions (like a car driving in a circle). The velocity of the box could be in some direction, but its acceleration could be in any direction; this is because acceleration is a measure in the chance in velocity, but not the 'net' velocity vector of an object.",2,"(1,1,1,0,1,0,1,0,0)",1,45:33
FALSE,Student 53,"If the force is acting on it in the positive x direction, then the box must be moving in the positive x direction and will therefore have a parallel acceleration to the x axis since it is not speeding up. The velocity would also be parallel because its direction is positive. I disagree with myself as I type this but I'm not sure what my opposing argument is.",3,"(1,1,0,0,1,0,1,1,1)",0,25:23
TRUE,Student 9,"If a 3 people were pushing the box but one person was pushing harder than the rest, the box would accelerate in the same direction as the greater force. However, with velocity, the final velocity has to take into account the initial velocity. Though the acceleration might go to the right, if the velocity was going upwards, the box might move at a slant.",2,"(1,1,0,1,1,1,1,1,1)",0,48:08
FALSE,Student 56,"If the net force on a box is in the positive x-direction, then the box moves in that direction. As force is something that causes objects to accelerate, this indicates the box's acceleration is parallel to the x-axis. Furthermore, if acceleration is the change of velocity then the velocity must be parallel to the x-axis.",3,"(1,1,0,0,1,0,1,1,1)",1,39:17
TRUE,Student 33,"Its Acceleration is parallel to the x axis because acceleration will always point in the same direction as F. This relationship is described using the equation F=ma. Because mass is constant, the force and acceleration will always point in the same direction, and because net force is parallel to the x-axis, acceleration will be too. Velocity may or may not be parallel, but it is impossible to know if one does not know if the box is moving already or not.",2,"(1,1,1,0,1,1,1,0,0)",1,25:29
