correct,student_id,Text,Uncertainty,Feature Vectors,Other Strategy,Time
TRUE,Student 45,"This is true because acceleration is the change in velocity over a certain period of time, and the change in velocity (not the velocity) moves in the same direction as the net force according to Newton's second law of motion.",2,"(0,0,0,0,0,0,0,0,0)",1,32:15
TRUE,Student 75,"We from Newton's second law that F = m*a. As a result, it can be concluded that force must be equal to the acceleration, which means that if force is in a specific direction, the acceleration must be in that direction. However, velocity does not have to be in the same direction as the force: picture a rocket ship moving through space sideways, that then suddenly turns on the engine. It's velocity will still be mostly in the sideways direction, but the force will be pointing a completely different direction.",2,"(1,1,0,0,1,0,1,1,0)",1,16:38
TRUE,Student 99,"According to Newton's second Law, F(net) = ma, we could know that the direction of a is the the direction of F(net)",2,"(0,0,0,0,0,0,0,0,0)",1,05:37
FALSE,Student 42,"Since the box is moving in the positive direction, the velocity is moving parallel to the x axis because it's increasing.",1,"(1,0,0,1,0,1,0,0,0)",0,11:05
FALSE,Student 21,"Force is how much an object's velocity can change, so as it accelerates in the positive direction, its net velocity should also go in that direction.",3,"(1,1,0,1,1,1,1,0,1)",0,17:14
TRUE,Student 16,The acceleration (and only the acceleration) must be parallel to the x axis in this situation because net force causes an acceleration in the same direction as that net force. This does not require the velocity vector to point in the same direction as the acceleration because the change in velocity and the velocity itself are separate things represented by separate vectors.,2,"(0,0,0,0,0,0,0,0,1)",0,29:00
TRUE,Student 49,The acceleration would be parallel to the x-axis because the net force is staying the same. The velocity would keep accelerating therefore it would not be parallel.,2,"(0,0,0,0,0,0,0,0,0)",0,14:45
TRUE,Student 104,Force is directly related to acceleration,2,"(0,0,0,0,0,0,0,0,0)",1,12:37
FALSE,Student 32,The force causes the velocity and the acceleration to point in the x direction,3,"(0,0,0,0,0,0,0,0,1)",0,19:56
TRUE,Student 63,The acceleration has to be parallel to the x axis because since the force of the box is going in that positive x direction the acceleration is going the same way,2,"(1,1,0,0,0,0,0,0,0)",1,40:49
FALSE,Student 93,"It is not necessary for a velocity to be parallel to the x-axis, since by Newton's Second Law, F=m*a. What matters here is a-acceleration",3,"(0,0,0,0,0,0,0,0,0)",1,01:33
TRUE,Student 94,"Acceleration is equal to force divided by mass. Mass won't affect the direction of the force, so acceleration and force must be in the same direction.",2,"(0,0,0,0,0,0,0,0,0)",1,25:12
FALSE,Student 92,"If a force is being exerted win the positive direction, the acceleration has to be positive given the formula F=ma (mass can't be negative) and if the acceleration is positive, so is the velocity",3,"(0,0,0,0,0,0,0,0,1)",1,29:50
TRUE,Student 46,"I say the answer is b because we know force and acceleration have the same direction according to Newton's Second Law, so if the net force of the box is going in the positive x-direction, so will acceleration. I did not choose c because there is no info given about velocity, so I can not determine if it is also parallel to the x-axis.",2,"(1,1,0,1,1,0,1,0,0)",1,28:21
FALSE,Student 89,"Based on newton's second, we know that fnet is mass(acceleration). Since we know that fnet is positive in the x direction, we can also say that it's acceleration has to be greater than 0. But does that also means if the acceleration is positive, would the velocity also be positive?",3,"(0,0,0,0,0,0,0,0,0)",1,34:35
FALSE,Student 83,"Since the force is in the positive direction, then its acceleration must be as well. Therefore, if its acceleration is in the positive direction, so is its velocity.",3,"(0,0,0,0,0,0,0,0,0)",1,26:04
TRUE,Student 100,"The net force and the acceleration are both vectors, and according to Newton's Second Law, F=ma, which means that net force and the acceleration must move in the same direction. Thus, since the net force is in the positive x position, the acceleration is also in the positive x direction. However, the velocity doesn't relate to the net force and the acceleration (which is the change of the velocity), so it could point at any position while the net force is in the positive x direction.",2,"(0,0,0,0,0,0,0,0,0)",1,33:51
TRUE,Student 2,"I believe that the second choice is the answer because when a force is acted upon a mass, there is acceleration going in that same direction, f=ma",2,"(0,0,0,0,0,0,0,0,1)",1,35:01
FALSE,Student 96,"Since force causes acceleration, then a net force acting on a box in the positive x-direction would cause the box to accelerate in this same direction because it is directly being subjected to the net force. I'm pretty sure the velocity would also be parallel to the x-axis but I was more confused about this part. My guess would be that since the net force is in the direction to the positive x-direction and the net acceleration is in the same direction, then the velocity would have to also be moving in that direction making it parallel to the x-axis.",3,"(1,1,0,0,1,0,1,1,1)",0,35:35
FALSE,Student 68,Let's say the positive x direction is the right. The box could be speeding up to the right in which case both its velocity and acceleration would be pointing to the positive x direction. The box could also be moving to the negative x direction before another force is exerted on in and since the net force is pos x direction the velocity is still moving to the pos x direction but since the box is slowing down the acc is in the negative x direction. Either way the velocity and acceleration are both parallel to the x axis.,3,"(1,1,0,1,1,1,1,1,0)",0,39:49
FALSE,Student 41,The velocity is parallel to the x-axis because whereever the direction of the poitive x is going the box is going to be moving with it making it parallel to the direction that it is getting pushed. The velocity has to be increasing if it is going in the positive direction.,1,"(1,0,0,1,1,1,1,1,0)",0,23:20
TRUE,Student 25,"The acceleration will be parallel to the x axis because Newton's second law states that net force and acceleration have to point in the same direction. As for the velocity, I think its direction will depend on whether the object was at rest at t=0",2,"(1,0,0,0,1,1,1,0,0)",1,48:51
FALSE,Student 30,"The direction of the net force is equal to the direction of motion and therefore the direction of velocity. Since force is equal to the product of an object's mass and acceleration, the net force in a particular direction will give rise to a net acceleration in the same direction.",3,"(1,1,1,0,1,0,0,0,1)",1,29:36
FALSE,Student 73,Since the net force is in the positive x-direction the box will be moving parallel to the x-axis however acceleration can still be negative so there is no guarantee acceleration will be parallel to the x-axis,1,"(1,1,0,1,0,0,0,0,0)",1,20:23
TRUE,Student 18,"The acceleration would be parallel to the x-axis because the force causes the acceleration, and like the video explains, the direction of the force and acceleration are always the same. The force is directly related to the change in velocity/acceleration in this sense, but not the velocity itself, which is why the velocity doesn't necessarily have to be in a specific direction.",2,"(0,0,0,0,0,0,0,0,1)",0,17:42
FALSE,Student 20,"because net force is along the x axis, common sensically, it would make sense that the box would move in the positive x direction, which would be parallel to the x axis",3,"(1,1,0,0,1,0,1,0,0)",0,19:03
TRUE,Student 5,"Since F = ma, force in the x-direction would mean that the acceleration would have to be moving directly in the x-direction as well, or else the force wouldn't be in the positive x-direction. However, having a positive x-direction net force does not necessarily mean that the velocity is also parallel to the x-axis, since the box could have moved in the negative x-direction at some point.",2,"(1,1,0,1,1,1,1,0,0)",1,16:56
TRUE,Student 90,The acceleration is parallel to the x-axis as the force and the acceleration are directly related.,2,"(0,0,0,0,0,0,0,0,0)",1,24:27
TRUE,Student 15,Force is what accelerates an object hence we cannot say anything about velocity.,2,"(0,0,0,0,0,0,0,0,1)",1,04:45
FALSE,Student 59,"since the force of the box is moving in the positive x-direction, the motion of the box will be in the same direction as the force. Like using a leaf blower on leaves. The force of the leaf blower blows away from the person and when that force acts on the leaves the leaves also blow away from the person",3,"(1,1,0,1,1,1,1,1,1)",1,34:15
TRUE,Student 13,There is no information about the initial velocity or the final velocity so its impossible to determine anything about the velocity. The direction of the force determines the direction of acceleration as force is the cause of motion.,2,"(0,0,0,0,0,0,0,0,1)",0,34:09
TRUE,Student 39,"In Newton's 2nd Law, he states that the direction of the force equals the direction of acceleration equals the direction of CHANGE in velocity.",2,"(0,0,0,0,0,0,0,0,0)",1,30:22
TRUE,Student 11,"a = dv/dt, v = -3t^2",2,"(0,0,0,0,0,0,0,0,0)",0,03:52
TRUE,Student 91,"It need not be moving in the positive x direction (yet). The force on it may not be sufficient to have changed its direction, if it was previously going a direction direction. But, it must at least be accelerating in the positive x direction. That is, its velocity is changing in that direction, gradually.",2,"(1,1,0,0,1,0,1,1,0)",0,34:32
FALSE,Student 101,"force causes acceleration, they are proportional based on mass (constant of proportionality), so a force in the positive x direction will cause acceleration in the same direction (which is parallel to x-axis)",,"(0,0,0,0,0,0,0,0,1)",0,51:52