correct,student_id,Text,Uncertainty ,Feature Vectors,Other Strategy,Time 
TRUE,Student 31,"If the belt (and thus the girl) is moving 2m/s in the positive direction relative to the ground and the dog is moving 6m/s in the negative direction relative to the ground, the girl and the distance between the girl and the dog is decreasing at the are of the sum of the speeds of the girl and the dog. And thus, the dog is moving at a speed of 6m/s + 2m/s = 8m/s relative to the girl.",2,"(1,1,1,1,1,1,1,1,0,0,0)",1,27:32
TRUE,Student 47,"The girl is simply standing on the conveyor belt, she is not moving. Therefore, her speed is 0m/s, and the speed of the dog relative to the girl is the same as the speed of the dog relative to the belt.",2,"(1,1,1,0,0,1,1,0,1,0,0)",0,54:20
TRUE,Student 29,"The dog is moving at a speed of 8 relative to the girl, because it is moving at a speed of 8 relative to belt, which is moving at the same speed as the girl.",2,"(1,1,1,0,0,1,1,1,0,0,0)",0,24:23
TRUE,Student 51,"Since the girl is not moving relative to the belt, the dogs motion relative to the girl is the same as its motion relative to the belt, which has a speed of 8 m/s.",2,"(1,1,1,0,0,1,1,0,0,0,0)",0,19:01
FALSE,Student 14,"The girl is going 2 m/s because she is standing on the belt and not moving. The velocity of the dog compared in relation to the belt is 8 m/s. Therefore the answer is the same, 6 m/s.",1,"(1,1,1,0,0,1,1,0,1,0,0)",1,20:02
TRUE,Student 78,"Since the dog's speed relative to the belt is 8m/s, and the girl is on the belt not moving, she will be moving toward the dog at a speed relative to the belt of 0m/s, meaning that only the dog's speed is influencing how fast it is approaching the girl. If the girl was moving closer and farther away from the dog, then the speed of the dog relative to the girl would change.",2,"(1,1,1,1,1,1,1,0,1,0,1)",0,38:10
TRUE,Student 88,"Since the girl and the dog are both on the conveyor belt moving to the right at 2m/s, than the girl would see the dog coming at her at 8m/s because they're both moving left together and therefore that movement doesn't matter from the perspective of the girl.",2,"(1,1,1,1,1,1,1,1,1,1,0)",0,52:56
FALSE,Student 34,"Since the girl is moving toward the dog at 2m/s with the conveyor belt, and the dog is moving 8m/s toward the girl, the dog will be going 10m/s relative to the girl.",3,"(1,1,1,1,0,1,1,0,1,0,0)",1,52:27
TRUE,Student 58,"The girl and dog are both on the same surface/reference frame: the conveyor belt. Since they're moving at the same speed before accounting for the dog's speed, the dog's speed is the only factor here in closing the distance between the two. That is, until the conveyor runs out of space and deposits the dog and/or girl at the end.",2,"(1,1,1,0,0,0,1,0,1,1,0)",0,23:08
TRUE,Student 62,"I chose 8 m/s because the girl and the dog are both on the belt so the belt's speed does not really matter. As a result, the dog is moving 8 m/s relative to the girl.",2,"(1,1,1,0,0,0,1,0,1,1,0)",0,30:38
TRUE,Student 87,"The girl is moving along with the belt, seeing as she is stationary (standing) relative to the belt. Therefore, the dog's velocity relative to the belt is the same as the dog's velocity relative to the girl. This also makes sense using vector addition: (Vd,b + Vb,girl = Vd,girl ; 8 m/s + 0 m/s = 8 m/s).",2,"(1,1,1,0,0,1,1,1,1,1,0)",1,42:35
TRUE,Student 104,"Since the girl is not moving, the speed of the dog relative to the girl will remain the same.",2,"(1,1,0,0,0,1,1,0,0,0,0)",0,26:55
TRUE,Student 15,There is no need to subtract 2m/s as both the dog and the girl are both experiencing the speed of 2m/s to the right as they are standing on the same belt.,2,"(1,1,1,0,1,1,1,0,1,1,0)",0,04:44
FALSE,Student 30,"From the girl's perspective she is stationary, therefore the dog will be moving towards her at 8 m/s plus the speed at which the girl is moving so 10 m/s. Suppose the girl and the dog are 10 m apart, then it will take 1 second for the dog to cover 8 m and in that same time the girl would have covered 2 m so from the girl's perspective the dog covered that 10 m in 1 second. Thus, the dog's speed from the perspective of the girl is 10 m/s",3,"(1,1,0,1,0,1,1,0,0,0,1)",0,31:22
TRUE,Student 74,"the girl is not moving while on the moving belt. as a result, the answer is the same as the velocity of the dog relative to the belt.",2,"(1,1,1,0,0,1,1,0,1,1,0)",0,20:07
TRUE,Student 42,"The dog's speed relative to the girl would be 8 m/s because she is also on the conveyer belt. This means that they both relative to the belt, which in other words means that they share the same reference frame, so they see the same speeds that objects move at.",2,"(1,1,1,0,0,0,1,0,1,1,1)",0,29:54
TRUE,Student 28,"The girl is standing at rest on the belt. The dog is moving at 8m/s on the belt. Since they are both on the same surface, we can assume that the belt acts as a ""ground"". Therefore, the dog moves 8m/s faster than the girl.",2,"(1,1,1,0,0,1,1,0,1,1,0)",0,23:13
TRUE,Student 48,"Again, the way I processed this question was by first identifying that this is happening at a 1D level. Therefore, we can employ the idea of V vector a,c = V vector a,b + V vector b,c; in this case, it was V vector dog,girl = V vector girl,belt + V vector dog,belt, where V vector dog,girl = 0 m/s - 8 m/s. This lead to -8 m/s being the velocity of the dog in relation to the ground (or 8 m/s in the negative direction). The girl's velocity in relation to the belt is 0 m/s because she is simply standing on it.",2,"(1,1,1,0,0,1,1,1,1,0,0)",1,44:20
TRUE,Student 37,"Because both the girl and the dog are moving 2 m/s on the belt, the dog's speed is 8 m/s relative to the girl, as there is no need to take into account the 2 m/s that the girl and the dog are moving at.",2,"(1,1,1,0,0,1,1,0,1,1,0)",0,15:09
FALSE,Student 76,"We know that the girl is moving 2m/s relative to the belt because she is just standing on the belt and it is given that the dog relative to the belt is moving -8m/s. Then we can set up the equation: Vdog,girl+Vgirl,belt=Vdog,belt and plug in the values we know, which will then get us that the dog relative to the girl is moving 10m/s.",3,"(1,1,1,0,0,1,1,0,1,1,0)",1,31:14
FALSE,Student 98,The woman and the dog are both moving closer and closer to one another. The woman is moving at a rate of 2 m/s while the dog runs towards her at a rate of 8 m/s. Therefore the two objects are getting closer to one another at a rate of 10 m/s.,3,"(1,1,0,1,0,1,1,0,0,0,0)",1,35:47
TRUE,Student 72,"The girl is not moving in respect to the belt so that would be 0 m/s. The dog is moving 8 m/s. When we are thinking about the speed of the dog relative to the girl, we are only concerned with the dogs speed relative to the belt and the girls speed relative to the belt for our addition. So we add 0 m/s to 8 m/s to get 8 m/s as the speed of the dog relative to the girl.",2,"(1,1,1,0,0,1,1,0,1,1,0)",1,53:26
TRUE,Student 23,"Because the girl is standing still on the belt, she can be simply regarded as a point on the belt, which moves at 2m/s to the right. As the dog is moving at 8m/s to the left relative to the belt, it should be also moving at 8m/s to the right relative to the girl as they take the same reference frame, which is the belt.",2,"(1,1,1,1,1,1,1,1,1,1,1)",0,31:58
TRUE,Student 65,"I believe that the dogs movement relative to the girl is 8m/s because the girl is moving at 2 m/s towards the dog while the dog is running at 8 m/s towards the girl. However, from the previous problem, we know that the dog is moving at 6m/s with respect to the ground, this means that when the dog hits the conveyor belt, the dogs speed slows down to 6 m/s towards the girl. Since the girl is moving at 2 m/s towards the dog, we can add both of these vectors together, 2+6=8m/s",2,"(1,1,1,1,0,1,1,0,0,1,0)",1,20:13
FALSE,Student 35,You have to add the two velocities and the girl is moving 8 m/s and the dog is moving -2 m/s which means the speed of the dog relative to the ground in 6 m/s.,1,"(1,1,0,0,0,1,1,0,0,0,0)",1,25:29
TRUE,Student 3,"The girl moves at an equal rate as the belt. Therefore her speed relative to the belt is 0 m/s. The speed of the dog relative to the belt is 8 m/s. Taking the sum of the two speeds, one finds that the speed of the dog relative to the girl is 8 m/s.",2,"(1,1,1,0,0,1,1,0,0,0,0)",1,35:42
FALSE,Student 43,The dog would reach the girl faster than if the girl was at rest so the speed of the dog must be faster to her than 8m/s,3,"(1,1,0,0,0,1,1,0,0,0,0)",0,23:24
FALSE,Student 77,"The girl is moving towards the dog at 2 m/s so as opposed to the dog moving 8m/s when the girl isn’t moving, her velocity must be added to the dogs but because the dogs velocity is negative as opposed to the girls you are subtracting a negative number",3,"(1,1,0,1,0,1,1,0,0,0,0)",0,16:20
TRUE,Student 4,The speed of the dog relative to the girl is the same as the dog relative to the belt since the girl is standing still on the belt,2,"(1,1,1,0,0,1,1,0,1,0,0)",0,22:26
TRUE,Student 27,"Because the dog and the girl are on the same surface and the girl is standing still, the dog is running at 8 m/s towards the girl because even though the dog is getting ""pushed back"", the girl is getting pushed back at the same rate.",2,"(1,1,1,1,0,1,1,0,1,1,0)",0,21:18
TRUE,Student 84,"Since the girl is standing on the belt instead of moving, what she sees is the dog running at 8m/s towards her on the belt.",2,"(1,1,1,1,0,1,1,0,1,1,1)",0,47:12
FALSE,Student 70,"To be honest, I am struggling with applying the math to this situation. Playing the situation out in my head, I know that the person's movement along the conveyor belt makes her move closer to the dog faster, so the 2m/s of the conveyor belt is added to the 8m/s of the dog's motion toward her, but I don't know how to reconcile assigning positive values to two diametrically opposed motions.",3,"(1,1,1,1,0,0,1,1,0,0,0)",1,44:35
FALSE,Student 89,"Since the girl is standing still on the conveyor belt that has velocity of 2 m/s relative to the ground, wouldn't the girl have the same velocity with respect to the belt which is 2 m/s.",1,"(1,0,1,0,0,1,0,1,1,0,0)",0,53:25
FALSE,Student 66,"I am actually not too sure about this question. Logically I feel like the answer has to be 10 because when two objects are moving towards each other they appear to go faster when you are looking from the point of view of the objects. But, when you add the two vectors together you get the same answer as before, 6m/s. To me that just doesnt make any sense so I am going to stick with 10 as the answer that logically makes sense to me.",3,"(1,1,0,1,0,1,1,0,0,0,1)",1,21:30
TRUE,Student 83,The girl is moving at the same speed as the belt and the dog's speed was given relative to the belt.,2,"(1,1,1,0,0,1,1,0,0,0,0)",0,21:34
TRUE,Student 1,This can just be thought of as the girl standing on the ground and the dog running at her at 8 m/s. The question does not concern the perspective of the ground at all.,2,"(1,1,0,1,0,1,1,0,0,0,0)",0,32:03
FALSE,Student 52,"I think the answer may still be six because since the girl is standing on the belt her speed would equate to the speed of the belt which is 2 m/s while the dog is still moving -8 m/s. With respect to the girl, the speed is still 6 m/s since its the abs. value of -8 plus 2.",1,"(1,1,1,0,0,1,1,1,1,0,0)",1,19:10
TRUE,Student 103,"If girl and dog are evaluated with respect to ground, girl is moving at 2 m/s to the right and dog is moving at 6 m/s to the left. Since dog is approaching girl and together they approach each other at 6+2 m/s, dog is moving at 8m/s relative to girl.",2,"(1,1,0,1,0,1,1,0,0,0,0)",1,54:30
TRUE,Student 81,"Since the girl is not moving with respect to the belt, but both the dog and the girl are moving on the belt with respect to the ground, the speed of the dog is 8 m/s.",2,"(1,1,1,0,0,1,1,0,1,1,0)",0,24:00
TRUE,Student 67,"She is not moving with the belt, and the dog is moving 8 m/s compared to the belt.",2,"(1,1,1,0,0,1,1,0,0,0,0)",0,09:44
TRUE,Student 32,"The girl is standing on the belt, so the dog's speed relative to the girl will be the same os the dog's speed relative to the belt",2,"(1,1,1,0,0,1,1,0,1,0,0)",0,25:22
TRUE,Student 8,"Both the dog and the girl are on the conveyer belt, i.e. they can both be measured against the same reference frame. The girl is stationary to the conveyer belt, while the dog is moving 8 m/s towards the girl to the conveyer belt.",2,"(1,1,1,1,0,1,1,0,1,1,1)",0,34:05
FALSE,Student 54,"If the woman is already moving forward at a pace of 2 mph and there is a dog running towards her at 8 mph if you were to think about them moving on a non-moving surface it would feel as though the dog was traveling at her at a speed of 10 mph. If this was to happen on solid ground, but instead the woman was talking 2 mph forward, and the dog was running forward 8 mph, the result would be the same.",3,"(1,1,0,1,0,1,1,0,0,0,1)",0,42:32
FALSE,Student 24,"For this question we are looking for the speed of the dog relative to the girl, we know that the speed of the dog relative to the belt is 8 m/s and the speed of the girl is the same as the conveyer belt since she is standing (not moving) which is 2 m/s, so we would add both getting an answer of 10 m/s.",3,"(1,1,1,0,0,1,1,1,1,0,0)",1,53:17
FALSE,Student 9,"To the woman, she is stationary and not actually moving. However as the belt moves her forwards by 2 m/s, she gets closer and closer to the dog moving towards her at 8m/s. In this case we add the velocities and the dog seemingly moves at a speed of 10 m/s.",3,"(1,1,1,1,0,1,1,1,1,0,0)",1,33:33
TRUE,Student 90,"The speed of the dog relative to the is 6 m/s as found in the question above, however, this time it is shown in the diagram that the girl is moving in the direction of the dog. From this, from the girl's point of view, it will seem as if the dog is actually moving faster than it is. Therefore, you can add the velocity of the girl relative to the ground and the dog relative to the ground.",2,"(1,1,0,0,0,1,1,0,0,0,1)",1,38:28
FALSE,Student 68,"Since the girl is moving towards the girl, and the girl is also moving towards the dog, the dog appears to be approaching faster than it is actually moving. This understanding is applied to the speed of the dog by adding the speed the girl is moving towards the dog(2m/s) and the speed the dog is moving towards the girl(8m/s).",3,"(1,1,0,0,0,1,1,0,0,0,1)",1,25:55
TRUE,Student 44,"in this case, since the girl's velocity relative to the belt is 0, and the dog's velocity relative to the belt is -8m/s the speed of the dog relative to the girl is |-8m/s|",2,"(1,1,1,1,0,1,1,0,0,0,0)",0,24:03
TRUE,Student 38,"I chose 8 m/s because I applied the same formula here. To find the velocity of the dog relative to the girl, we have to add the velocity of the dog relative to the belt, and the velocity of the belt relative to the girl. We know the dog's velocity relative to the belt is -8m/s, and the girl is standing stationary on the belt, thus making the belt's velocity relative to the girl 0 m/s. If we add these, we still get 8 m/s.",2,"(1,1,1,1,0,1,1,0,1,0,0)",1,42:44
TRUE,Student 39,"Because V(A, B) = V(A, C) + V(C, B); V(dog, girl) = V(dog, belt) + V(belt, girl) Thus V(dog, girl) = (-8 m/s) + (0 m/s) = -8 m/s",2,"(1,1,1,0,0,0,0,0,0,0,0)",1,18:17
FALSE,Student 49,The girl is moving to the dog at 2m/s and the dog is moving to the girl at 8m/s so you combine the two forces to get 10m/s,3,"(1,1,0,1,0,1,1,0,0,0,0)",1,09:12
TRUE,Student 102,"Since the dog and the girl are both on the treadmill, they both have the same reference relative to the treadmill. Thus, the girl and dog do not seem to be affected by the treadmill, thus going 8 m/s towards her.",2,"(1,1,1,1,0,0,1,0,1,1,0)",0,08:49
TRUE,Student 97,"the girl and the dog are both affected by the conveyor belt, so its speed is not factored in. The dog is running at 8 m/s.",2,"(1,1,1,0,0,0,1,0,1,1,0)",0,04:06
TRUE,Student 71,"First, imagine that the conveyor is made of connected tiles 1 meter x 1 meter. If the girl was the tile she is standing on (for the sake of simplifying this) and was treated as the origin of a 2D line, the dog would be moving towards it at a rate of 8 tiles per second; the dog moved eight tiles from the one it had just been sitting on in 1 second. So, relatively, the dog is moving 8 meters (or 8 tiles) per second toward the girl. That's pretty fast!",2,"(1,1,1,1,0,0,1,0,1,1,0)",0,49:05
FALSE,Student 53,You would add the 8 m/s and 2/s because they are both coming together towards each other. This would result in a velocity of 10 m/s.,3,"(0,0,0,0,0,0,0,0,0,0,0)",1,29:24
TRUE,Student 40,"The velocity of the dog relative to the girl is equal to the velocity of the dog relative to the belt plus the velocity of the belt relative to the girl. The velocity of the dog relative to the belt is 8 and the velocity of the belt relative to the girl is 0 (because the belt and the girl are moving at the same speed and direction. So, since 8+0=8, the speed of the dog relative to the girl is 8 m/s.",2,"(1,1,1,0,1,1,1,1,0,0,0)",1,33:15
TRUE,Student 69,"Since the girl is not moving on the belt, her speed relative to the belt would be 0 m/s and because we are observing the dog's speed relative to her, the dog would be going 6 m/s since she isn't moving. Basically like a person on a train looks like they're going a normal speed inside the train but outside like are going really fast relative to the ground.",2,"(1,1,1,0,0,1,0,0,1,0,1)",0,35:05
TRUE,Student 99,"the girl is moving at the same speed to of belt relative to the ground( in other words, the girl is standing still relative to the belt), so the speed of dog relative to the girl would equal to the speed of dog relative to the belt.",2,"(1,1,1,0,0,1,1,1,0,0,0)",0,11:37
TRUE,Student 12,"Since the girl is also on the belt that is moving, the dog would be moving the same speed relative to the girl that it would be relative to the belt.",2,"(1,1,1,0,0,1,1,1,1,0,0)",0,26:47
FALSE,Student 91,"Here, we again combine the two vectors to get our answer, but we have 8m/s + 2m/s = 10m/s. The difference is that the two vectors are working together to shorten the distance.",3,"(0,0,0,0,0,0,0,0,0,0,0)",1,22:43
TRUE,Student 33,"The answer would be 8m/s because the girl is moving at the same speed as the, and the velocity of 8 m/s of the dog relative of the belt should be interchangeable with the speed of the dog with respect to the girl.",2,"(1,1,1,0,0,1,1,0,0,0,0)",0,26:35
TRUE,Student 64,"The girl and the dog are both on the belt. If both their velocities were 0, then they would be stationary relative to each other. Because the dog is moving relative to the belt, it is also moving relative to the girl and at the same rate since she is at rest relative to the belt.",2,"(1,1,1,0,0,1,1,0,1,1,0)",0,05:02
TRUE,Student 86,"The girl is standing on the belt and is not moving on the belt. But since the dog is, its speed will be 8m/s relative to the girl.",2,"(1,1,1,0,0,1,1,0,1,1,0)",0,13:29
TRUE,Student 16,"The speed of the girl relative to the belt is 0 m/s. The speed of the belt relative to the dog is 8 m/s. Thus, the speed of the girl relative to the dog is 8 m/s.",2,"(1,1,1,0,0,1,1,0,0,0,0)",1,49:16
FALSE,Student 95,"The girl is moving towards the dog, so the dog will catch her sooner than he would if she was still on the ground. Therefore, the dog is moving faster relative to the girl by 2 m/s, which is the speed of the conveyor belt.",3,"(1,1,1,0,0,1,1,1,0,0,1)",0,13:10
FALSE,Student 63,The speed is still 10 because since the girl is not moving she is moving the same speed as the conveyer belt so the result is still the same,3,"(1,0,1,0,0,1,0,1,0,0,0)",0,29:27
FALSE,Student 82,"Since the girl is on the floor/belt, the velocity of the dog is the same when its relative to her as well. The women would see the dog going at her at 6m/s.",1,"(1,1,1,0,0,0,1,0,1,0,0)",0,35:41
TRUE,Student 101,"Both the dog and the girl are moving with the belt, so the movement of the belt does not influence the dog relative to the girl. Therefore, the dog is moving 8 m/s relative to the girl.",2,"(1,1,1,0,0,1,1,0,1,1,0)",0,26:19
FALSE,Student 41,I believe that the answer is 10 m/s because since the lady is getting closer to the dog at 2 m/s and the dog is getting closer to her at 8m/s from the perspective of the lady the dog is coming at 8 m/s because every second she is getting 2 m/s closer.,3,"(1,1,0,1,0,1,1,0,0,0,0)",1,29:09
TRUE,Student 73,"Because she is standing still, although the conveyor belt is moving, the dog remains approaching at 8m/s, and therefore the dog moves 8m/s relative to the girl because there is no opposing movement to add or subtract.",2,"(1,1,1,0,0,1,1,1,1,0,0)",0,31:30
TRUE,Student 46,"Using velocity relations for relative motion again, we can see that the dog is going 8 m/s relative to the belt (v(a,c)). The girl is going 0 m/s relative to the belt because she is just standing, not moving (v(c,b)). So, if we add 8 m/s and 0 m/s, we get 8 m/s. We are not concerned with the ground in this answer, just the belt.",2,"(1,1,1,0,0,1,1,0,1,0,0)",1,30:58
FALSE,Student 25,"Even though the view point changed, the movement of the belt will still effect the speed of the dog, so it will look like the dog has a velocity of 6 m/s.",1,"(0,1,1,0,0,0,1,1,0,1,0)",0,32:51
TRUE,Student 19,"The dog's speed with respect to the girl would be 8 meters / second, because the speed of the girl relative to the belt is 0, so the only velocity happening is the speed of the dog, which is 8 m/s.",2,"(1,1,1,0,0,1,1,0,0,0,0)",1,09:34
TRUE,Student 6,"Because both the dog and the girl are on the conveyor belt, the belt is relatively the stationary for them both. Therefore, the speed of the speed of the dog for the girl would be the same as the diagram shows.",2,"(1,1,1,0,0,0,1,0,1,1,0)",0,03:37
FALSE,Student 85,"Since the dog and the girl are moving toward each other, combining the velocity vectors will give the speed of the dog relative to the girl.",3,"(1,1,0,0,0,1,1,0,0,0,0)",1,22:18
FALSE,Student 45,"The speed of the dog relative to the girl will be 6m/s because I honestly see it as the two eventually colliding, meaning that within the same second that the dog travels 8m the woman also travels 2m. The remaining distance between the two will be 6m and the difference will decrease like this until the collision occurs. This is just my theory, which may be completely wrong.",1,"(1,1,0,0,0,0,1,0,0,0,0)",0,34:19
TRUE,Student 22,"The relative velocity equation can also be used in this situation. The relative speed of the dog to the girl is equal to the sum of the velocity of the dog on the belt and the velocity of the belt on the girl. Since the girl is not moving on the belt, her velocity is 0, making the sum 8 + 0 = 8 m/s.",2,"(1,1,1,0,0,1,1,1,0,0,0)",1,31:39
TRUE,Student 96,"Since the dog and the girl are both on the reference frame of the conveyer belt, the speed at which the conveyer belt is moving is irrelevant in this situation. Therefore, the dog is still running toward the girl at a velocity of 8 m/s.",2,"(1,1,1,1,0,0,1,1,1,1,0)",0,17:29
TRUE,Student 56,"The speed of the dog relative to the girl is 8 m/s. The speed of the dog relative to the belt is 8 m/s and the speed of the belt relative to the girl is 0 m/s (because the girl stands on the belt, moving at the same velocity as the belt moves with respect to the ground). When those are added together, it results in 8 m/s.",2,"(1,1,1,0,0,1,1,1,1,1,0)",1,40:16
TRUE,Student 50,The girl is not moving so her velocity is 0 m/s. The dog then is moving 8m/s toward the girl regardless of the velocity of the belt.,2,"(1,1,1,1,0,1,1,1,0,0,0)",0,37:27
TRUE,Student 21,Both the woman and the dog are on the conveyer belt,2,"(1,1,1,0,0,0,0,0,0,0,0)",0,28:13
TRUE,Student 92,"Since the velocity vector relating the girl to the belt is 0 m/s, and we add that vector to the vector relating the dog to the belt, the resultant velocity vector moves 8 m/s in the negative direction",2,"(1,1,1,1,0,1,1,0,0,0,0)",1,21:00
TRUE,Student 10,The dog and the girl are both on the conveyor belt. The velocity of the dog would be equal to the velocity of the dog with respect to the belt and the belt with respect to the girl. The girl is standing still which would be a vector of magnitude 0 plus the dog's velocity vector os 8 m/s to the left which gives 8 m/s to the left.,2,"(1,1,1,1,0,1,1,0,1,1,0)",1,38:40
FALSE,Student 2,"I feel like its the same as the first question, dog is going negative direction and girl postive so vgirl= -8+2= 6",1,"(1,1,0,1,0,0,0,0,0,0,0)",0,36:45
TRUE,Student 59,I'm having a hard time deciding between 6 and 8m/s but thinking about the elevator problem we did from inside the elevator the ball was moving the same as it would be if there was no elevator so i assume for this problem the same logic applies that since the lady is on the belt then the dogs speed should remain similar to how it would be if the belt wasnt there. the reason im still caught on 6m/s a little bit is because just like in the first part the dog is still running against the belt just like how earlier the girl was swimming against the current,2,"(1,1,1,1,0,0,1,0,1,1,0)",0,25:05
TRUE,Student 94,"The girl is at rest on the moving walkway; for the purposes of evaluating movement, she is essentially an extension of the belt. The dog's speed relative to her is the same as its speed relative to the belt.",2,"(1,1,1,0,0,1,1,0,1,0,0)",0,16:14
TRUE,Student 11,There would be no change in velocity of the dog on the conveyor belt along with the girl. They are both in the frame as well for this reason.,2,"(1,1,1,0,0,1,1,0,1,1,0)",0,01:23
