correct,student_id,Text,Uncertainty ,Feature Vectors,Other Strategy,Time 
TRUE,Student 79,"Relative to the girl, the dog is moving at a speed of 8 meters per second. This was was really tricky to understand at first, because the first thing that comes to my mind is including the speed of the belt. What's so important to understand is that relative to the belt, the girl is not moving. She's staying still relative to the belt while the dog is moving at a velocity of 8 meters per second in the opposite direction relative to the belt. Both the dog and the girl are on the moving belt, so this speed will not affect the velocity of the dog relative to the girl. So, if the girl is not moving (in relativity to the belt) and has a velocity of 0 m/s and the dog is moving at a speed of 8 m/s in relation to the belt, we can conclude that the dog is moving at a speed of 8 meters per second relative to the girl.",2,"(1,1,1,1,0,1,1,1,1,1,0)",0,49:46
TRUE,Student 5,"The dog is moving 8 m/s to the left on the conveyer belt, and the girl is standing still on the conveyer belt, so the 2 m/s to the right that both the dog and the girl are going does not matter with respect to the girl, and the dog's speed is just 8 m/s.",2,"(1,1,1,1,1,1,1,1,1,1,0)",0,14:46
TRUE,Student 57,"The girl's velocity is 0 m/s. So when we subtract 8 m/s by 0 m/s, we get 8 m/s. This makes sense because both the dog and the girl are unfazed by the velocity of the belt so the only relative speed they witness is that of each other's",2,"(1,1,0,0,0,1,1,0,0,0,0)",1,47:12
TRUE,Student 61,"The girl and the dog are getting closer. The girl is moving closer to the dog at 2 m/s and the dog is moving closer to the girl at 6 m/s. Therefore, from the perspective of the girl, the dog is moving 8 m/s. 6 m/s + 2 m/s = 8 m/s.",2,"(1,1,0,1,0,1,1,0,0,0,0)",1,35:27
TRUE,Student 18,"Since the girl is moving 2 m/s back with the conveyor belt, and from her reference frame she is not moving, the velocity of the dog is not affected by the velocity of the conveyor belt. Thus the dog is moving 8 m/s toward the girl.",2,"(1,1,1,1,1,1,1,1,1,1,0)",0,08:34
FALSE,Student 80,To the girl the dog appears to be moving at 6 m/s.,1,"(1,1,0,0,0,0,1,0,0,0,0)",0,29:02
TRUE,Student 100,"Since the girl is not moving on the belt, we can treat her as a point on the belt. Thus, the speed of the dog relative to the girl is the same as the speed of the dog relative to the belt.",2,"(1,1,1,0,0,1,1,0,1,0,0)",0,17:39
FALSE,Student 13,The dog is moving in the direction of the girl and the girl is moving the direction of the dog because the belt is moving the same way. So I added the dog's speed to the speed of the belt as that is what the girl will see when she sees the dog.,3,"(1,1,1,1,1,1,1,1,0,0,0)",1,38:38
TRUE,Student 7,"At first, I thought the dog would be moving 10 m/s relative to the girl (adding 2 m/s to 8 m/s). Then I realized the girl is not moving relative to the belt, so, from her perspective, the dog is only moving 8 m/s.",2,"(1,1,1,0,0,1,1,0,0,0,1)",0,27:24
TRUE,Student 60,"The dog and the girl are both on the belt, so its movement in relation to the ground can be ignored. She is standing still on the belt while the dog is moving left at 8 m/s, so the dog would appear to be moving its speed relative to the belt: 8 m/s.",2,"(1,1,1,1,0,1,1,1,1,1,0)",0,02:55
TRUE,Student 26,The girl is on the conveyor belt so she is moving at the speed of the conveyor belt relative to the ground so the speed of the dog relative to the belt should be equal to the speed of the dog relative to the girl.,2,"(1,1,1,0,0,1,1,1,1,1,0)",0,32:23
TRUE,Student 36,She's just watching the dog. So she sees how fast he is moving regardless of the effect of the walkway because they're both on it.,2,"(1,1,1,0,0,0,1,0,1,1,0)",0,05:07
TRUE,Student 75,"Relative to the walkway, the girl is stationary: she is only moving where the walkway moves her. As for the dog, we know from the question that the dog is moving 8 m/s relative to the walkway. As a result, we know that the dog (moving at 8 m/s) and the girl (moving at 0 m/s), are closing at 8 m/s.",2,"(1,1,1,0,0,1,1,1,1,0,0)",1,10:06